{
  "docId": "104-10004-10143",
  "title": "104-10004-10143 C06932208",
  "metadata": {
    "source": "National Archives",
    "collection": "JFK Files",
    "format": "PDF to Markdown to JSON",
    "conversion_timestamp": "2025-03-19T16:37:01.660444",
    "pages": 3,
    "date": "05/08/96"
  },
  "sections": [
    {
      "title": "Page 1",
      "level": 2,
      "content": "|104-10004-10143| [2025 RELEASE UNDER THE PRESIDENT JOHN F. KENNEDY ASSASSINATION RECORDS ACT OF 1992 |\nDate: 05/08/96\nPage: 1"
    },
    {
      "title": "RECORD NUMBER : 104-10004-10143 |",
      "level": 3,
      "content": "RECORD SERIES : JFK oo"
    },
    {
      "title": ": _ [R] + ITEM IS RESTRICTED",
      "level": 3,
      "content": "NW 64937 Docid:32106269 Page 1 |\n"
    },
    {
      "title": "Page 2",
      "level": 2,
      "content": "CAF eNcLASSIFIED 7 Oates ie i MB ventiat [] SECRET\nee ROUTING AND RECORD SHEET ,\n| SUBJECT: (Optional) ae : .\nFROM: LLP A JP 5S a a | EXTENSION sy . 5 j 3 rom\n20°\" |\n. / y ge\nINITIALS to whom. Draw a line across column after each comment.)\n“\noy 8 wR aa | w (Mor are\n: | Sf ot |\n| | A Bo~ 5\n. |\n5. ‘"
    },
    {
      "title": "PS/LPL ; .",
      "level": 3,
      "content": "& | for FOIA Review on JUN 1976\"\n. . ef\nnvicerosObQuseeateied Ba QESRET  ([] CONFIDENTIAL [[] Yse ony [| _ UNCLASSIFIED\n"
    },
    {
      "title": "Page 3",
      "level": 2,
      "content": ". - i \\e Sb\n. rs\n1 June 1964 - .\n4 . : ‘or\n‘ Oe .ussia\" be tron ony BER S% 0 jv $0 A J\na bd COS polsink) concen ing Aimbrtedle\nMEMO FOR THE RECORD yf OswAtdis Stay 7 et ° wBy .\nza\n° 1, At 0900 this morning I talked with Frank Friberg recently\nreturned COS Helsinki re Warren Commission inquiry concerning: ‘\nthe timetable of Oswald's Stay in Finland in October 1959, including ~\nhis contact with the Soviet Consulate there. (Copy of the Commission\nletter of 25 May 64 and State Cable of 22 May 64 attached.) 2\n2. Friberg gave me the following information: ;\na. It takes 25 minutes to drive from the airport to\n\" downtown Helsinki;\nb. By taxi, it would take no more than 5 minutes to .\n’ reach the Soviet consulate;\nc. The Soviet consulate probably closéd at 1300 hours Jocal |\ntime on Saturdays in 1959; ,\n. qd. Passenger lists (manifests) at the U.S. Consulate in :\nHelsinki are retained for six months only and then are destroyed.\nMr. Robert Fulton (CIA) was U.S. consular official there at .\nthe time.\na ) -e. A copy of State's cable inquiry would go to the Helsinki ) Oo\nStation and they would assist in preparation of a repty.\nwe 3. Mr. Friberg agreed that it would be worthwhile to cable che\nStation concerning points not covered by State in their inquiry. He — oO\nsuggested changes incorporated into the cable sent to Helsinki. ; :\n. ; - : , | a\nLee H. Wigren a, ae\nLO C/SR/CI/R ee | #\n- HEE oo _\n\n: [ris | ___|Paerane FoR FILSeiG\n- _ pre | (FH =\n\n‘Document Number £1 ¥38 coe aw 2.8. |\n, Tre rns ef\n. . 1s0/D¢u CABLE IDEN (11) '\nfor FOIA Review on. JUN 1976 | eo)\neg ‘ IP/FILES {FOR FILING I _\nte: - d € wo ’\n4 poc ** = BHO ,\nby oo,  D0\\-28ag\npane ees? Docid:32106269 Page 3 i :\n\n---\n\n*Document converted by JFK Files PDF2Markdown converter at 2025-03-19 16:37:01*\n*OCR: Enabled*\n*Quality: high*\n*GPT-assisted: No*\n*Conversion time: 4.11 seconds*\n\n"
    }
  ],
  "fullText": "# 104-10004-10143 C06932208\n\n## Page 1\n\n|104-10004-10143| [2025 RELEASE UNDER THE PRESIDENT JOHN F. KENNEDY ASSASSINATION RECORDS ACT OF 1992 |\nDate: 05/08/96\nPage: 1\n### : JFK ASSASSINATION SYSTEM\n### IDENTIFICATION FORM ,\n### AGENCY INFORMATION\n### AGENCY : CIA\n### RECORD NUMBER : 104-10004-10143 |\n\nRECORD SERIES : JFK oo\n### AGENCY FILE NUMBER : 201-289248\n### DOCUMENT INFORMATION\n### ORIGINATOR : CIA :\n### FROM : .\n### TO :. :\n### TITLE : DISCUSSION BETWEEN MEMBER SR DIVISION CONCERNING\n### OSWALD'S STAY IN HELSINKI.\n### DATE : 06/01/64\n### PAGES : 2 |\n### SUBJECTS : HELSINKI TRIP\n### | USSR CONSULATE .\n### DOCUMENT TYPE : PAPER, TEXTUAL DOCUMENT .\n### CLASSIFICATION : SECRET\n### RESTRICTIONS : 1B .\n### CURRENT STATUS : RELEASED WITH DELETIONS\n### DATE OF LAST REVIEW : 06/12/93\n### OPENING CRITERIA :\n### COMMENTS : OSW10:V43 1993.06.12.10:33:55:150000:\n### : _ [R] + ITEM IS RESTRICTED\n\nNW 64937 Docid:32106269 Page 1 |\n\n## Page 2\n\nCAF eNcLASSIFIED 7 Oates ie i MB ventiat [] SECRET\nee ROUTING AND RECORD SHEET ,\n| SUBJECT: (Optional) ae : .\nFROM: LLP A JP 5S a a | EXTENSION sy . 5 j 3 rom\n20°\" |\n. / y ge\nINITIALS to whom. Draw a line across column after each comment.)\n“\noy 8 wR aa | w (Mor are\n: | Sf ot |\n| | A Bo~ 5\n. |\n5. ‘\n### PS/LPL ; .\n\n& | for FOIA Review on JUN 1976\"\n. . ef\nnvicerosObQuseeateied Ba QESRET  ([] CONFIDENTIAL [[] Yse ony [| _ UNCLASSIFIED\n\n## Page 3\n\n. - i \\e Sb\n. rs\n1 June 1964 - .\n4 . : ‘or\n‘ Oe .ussia\" be tron ony BER S% 0 jv $0 A J\na bd COS polsink) concen ing Aimbrtedle\nMEMO FOR THE RECORD yf OswAtdis Stay 7 et ° wBy .\nza\n° 1, At 0900 this morning I talked with Frank Friberg recently\nreturned COS Helsinki re Warren Commission inquiry concerning: ‘\nthe timetable of Oswald's Stay in Finland in October 1959, including ~\nhis contact with the Soviet Consulate there. (Copy of the Commission\nletter of 25 May 64 and State Cable of 22 May 64 attached.) 2\n2. Friberg gave me the following information: ;\na. It takes 25 minutes to drive from the airport to\n\" downtown Helsinki;\nb. By taxi, it would take no more than 5 minutes to .\n’ reach the Soviet consulate;\nc. The Soviet consulate probably closéd at 1300 hours Jocal |\ntime on Saturdays in 1959; ,\n. qd. Passenger lists (manifests) at the U.S. Consulate in :\nHelsinki are retained for six months only and then are destroyed.\nMr. Robert Fulton (CIA) was U.S. consular official there at .\nthe time.\na ) -e. A copy of State's cable inquiry would go to the Helsinki ) Oo\nStation and they would assist in preparation of a repty.\nwe 3. Mr. Friberg agreed that it would be worthwhile to cable che\nStation concerning points not covered by State in their inquiry. He — oO\nsuggested changes incorporated into the cable sent to Helsinki. ; :\n. ; - : , | a\nLee H. Wigren a, ae\nLO C/SR/CI/R ee | #\n- HEE oo _\n\n: [ris | ___|Paerane FoR FILSeiG\n- _ pre | (FH =\n\n‘Document Number £1 ¥38 coe aw 2.8. |\n, Tre rns ef\n. . 1s0/D¢u CABLE IDEN (11) '\nfor FOIA Review on. JUN 1976 | eo)\neg ‘ IP/FILES {FOR FILING I _\nte: - d € wo ’\n4 poc ** = BHO ,\nby oo,  D0\\-28ag\npane ees? Docid:32106269 Page 3 i :\n\n---\n\n*Document converted by JFK Files PDF2Markdown converter at 2025-03-19 16:37:01*\n*OCR: Enabled*\n*Quality: high*\n*GPT-assisted: No*\n*Conversion time: 4.11 seconds*\n\n"
}