{
  "docId": "104-10004-10156",
  "title": "104-10004-10156",
  "metadata": {
    "source": "National Archives",
    "collection": "JFK Files",
    "format": "PDF to Markdown to JSON",
    "conversion_timestamp": "2025-03-19T16:37:10.505267",
    "pages": 3,
    "date": "1 June 1964",
    "agency": "CIA"
  },
  "sections": [
    {
      "title": "Page 1",
      "level": 2,
      "content": "‘\\fo4-t0004-10156) [2025 RELEASE UNDER THE PRESIDENT JOHN F. KENNEDY ASSASSINATION RECORDS ACT OF 1992\nbor @\n"
    },
    {
      "title": "Page 2",
      "level": 2,
      "content": "13-00000\n: . aia “Sita ,\n| 1 June 1964\ni MEMO FOR THE RECORD |\n| 1. At.0900 this morning I talked with Frank Friberg recently\nreturned COS Helsinki re Warren Commission inquiry concerning\n8 the timetable of Oswald's stay in Finland in October 1959, including\nhis contact with the Soviet Consulate there. (Copy of the Commission\n, letter of 25 May 64 and State Cable of 22 May 64 attached.) .\n_ 2. Friberg gave me the following information:\n_ a. It takes 25 minutes to drive from the airport to\n_ downtown Helsinki;\nb. By taxi, it would take no more than 5 minutes to\nreach the Soviet consulate;\n: c. The Soviet consulate probably closed at 1300 hours local\n: time 6n Saturdays in 1959;\nd. Passenger lists (manifests) at the U.S. Consulate in\n: Helsinki are retained for six months only and then are destroyed.\nMr. Robert Fulton (CIA) was U.S. consular official there at\nthe time.\ne. A copy of State's cable inquiry would go to the Helsinki\nStation and they would assist in preparation ofa reply.\n3. Mr. Friberg agreed that it would be worthwhile to cable the\nStation concerning points not covered by State in their inquiry. He\nsuggested changes incorporated into the cable sent to Helsinki.\nmt } '\n, Lee H. gren"
    },
    {
      "title": "-3 O C/SR/CI/R",
      "level": 3,
      "content": ". Document Number (OQ 7% 4\n‘ ree FAN .\nA Review on JUN 1976 ;"
    },
    {
      "title": "SAME AS TIO-638",
      "level": 3,
      "content": "Cael\n"
    },
    {
      "title": "Page 3",
      "level": 2,
      "content": "13-00000\nSee Sanitized File it\nNumber _ 339\nFor starils clev ce ee ne eee eee\n\n---\n\n*Document converted by JFK Files PDF2Markdown converter at 2025-03-19 16:37:10*\n*OCR: Enabled*\n*Quality: high*\n*GPT-assisted: No*\n*Conversion time: 3.44 seconds*\n\n"
    }
  ],
  "fullText": "# 104-10004-10156\n\n## Page 1\n\n‘\\fo4-t0004-10156) [2025 RELEASE UNDER THE PRESIDENT JOHN F. KENNEDY ASSASSINATION RECORDS ACT OF 1992\nbor @\n\n## Page 2\n\n13-00000\n: . aia “Sita ,\n| 1 June 1964\ni MEMO FOR THE RECORD |\n| 1. At.0900 this morning I talked with Frank Friberg recently\nreturned COS Helsinki re Warren Commission inquiry concerning\n8 the timetable of Oswald's stay in Finland in October 1959, including\nhis contact with the Soviet Consulate there. (Copy of the Commission\n, letter of 25 May 64 and State Cable of 22 May 64 attached.) .\n_ 2. Friberg gave me the following information:\n_ a. It takes 25 minutes to drive from the airport to\n_ downtown Helsinki;\nb. By taxi, it would take no more than 5 minutes to\nreach the Soviet consulate;\n: c. The Soviet consulate probably closed at 1300 hours local\n: time 6n Saturdays in 1959;\nd. Passenger lists (manifests) at the U.S. Consulate in\n: Helsinki are retained for six months only and then are destroyed.\nMr. Robert Fulton (CIA) was U.S. consular official there at\nthe time.\ne. A copy of State's cable inquiry would go to the Helsinki\nStation and they would assist in preparation ofa reply.\n3. Mr. Friberg agreed that it would be worthwhile to cable the\nStation concerning points not covered by State in their inquiry. He\nsuggested changes incorporated into the cable sent to Helsinki.\nmt } '\n, Lee H. gren\n### -3 O C/SR/CI/R\n\n. Document Number (OQ 7% 4\n‘ ree FAN .\nA Review on JUN 1976 ;\n### SAME AS TIO-638\n\nCael\n\n## Page 3\n\n13-00000\nSee Sanitized File it\nNumber _ 339\nFor starils clev ce ee ne eee eee\n\n---\n\n*Document converted by JFK Files PDF2Markdown converter at 2025-03-19 16:37:10*\n*OCR: Enabled*\n*Quality: high*\n*GPT-assisted: No*\n*Conversion time: 3.44 seconds*\n\n"
}